keyword,Title,Reviews,Review_points,Address,Country,City,State,Website,Phone,Latitude,Longitude,Category,Kecamatan,Kelurahan,Pasar_Amount,Landmark_Amount,Price_Range_Rp 100–125K,Price_Range_Rp 150–175K,"Price_Range_Rp 1–25,000","Price_Range_Rp 1–50,000","Price_Range_Rp 250,000+",Price_Range_Rp 25–50K,Price_Range_Rp 25–75K,Price_Range_Rp 50–100K,Price_Range_Rp 50–75K,Price_Range_Rp 75–100K,Busiest_time_Monday,Busiest_time_Tuesday,Busiest_time_Wednesday,Busiest_time_Thursday,Busiest_time_Friday,Busiest_time_Saturday,Busiest_time_Sunday,Populations_2023,Competitor,Review_rate,Average_review_points,Average_reviews,Max_reviews,Min_reviews,Success_rate,Success_rate_category_minor,Success_rate_category_major
Warung Kopi di Malang,11:12 sebelasduabelaskopi,1653.0,4.6,"Jl. soekarno Hatta PTP II No.12, Mojolangu, Kec. Lowokwaru, Kota Malang, Jawa Timur 65142, Indonesia",ID,Malang City,East Java,https://instagram.com/sebelasduabelaskopi,Tidak Ada,-7.9374224,112.6250887,Lainnya,Lowokwaru,Lowokwaru,33.0,79.0,False,False,False,False,False,True,False,False,False,False,8PM,8PM,8PM,8PM,8PM,8PM,7PM,19407,25,6076.58610785463,4.55,621.97,8486.0,1.0,243.06,0.0,243.06
Street Food Malang,Warung Julak (Spesialis Nasi Kuning Masak Habang & Soto Banjar),241.0,4.8,"Jl. Sigura - Gura No.18 kav 7, Sumbersari, Kec. Lowokwaru, Kota Malang, Jawa Timur 65145, Indonesia",ID,Malang City,East Java,https://instagram.com/warungjulak.mlg?igshid=YmMyMTA2M2Y=,+62 813-5755-5125,-7.9579494,112.6096219,Soto,Lowokwaru,Lowokwaru,33.0,79.0,False,False,True,False,False,False,False,False,False,False,8AM,9AM,8AM,9AM,8AM,9AM,9AM,19407,4,933.2,4.55,621.97,8486.0,1.0,233.3,233.3,0.0
Kuliner Malang Terbaik,Malang Degan Jelly (GITA),6.0,4.8,"Jl.widas k2, Bunulrejo, Kec. Blimbing, Kota Malang, Jawa Timur 65123, Indonesia",ID,Malang City,East Java,Tidak Ada,+62 895-3951-94805,-7.9654028,112.6473819,Lainnya,Blimbing,Blimbing,44.0,14.0,False,False,True,False,False,False,False,False,False,False,7PM,7PM,7PM,7PM,7PM,7PM,7PM,8733,11,5562.740738569753,4.52,664.83,6759.0,1.0,505.7,0.0,505.7
Restoran di Malang,Soto Ayam Lamongan Soetomo,1713.0,4.5,"Jl. Doktor Sutomo No.18, Klojen, Kec. Klojen, Kota Malang, Jawa Timur 65111, Indonesia",ID,Malang City,East Java,Tidak Ada,+62 858-8593-4645,-7.9711421,112.6350471,Soto,Klojen,Klojen,45.0,20.0,False,False,True,False,False,False,False,False,False,False,8AM,8AM,8AM,8AM,8AM,9AM,7PM,5928,6,3557.15,4.53,847.21,21451.0,1.0,592.86,0.0,592.86
Kuliner Malang Murah,Roketto Coffee & Co,3190.0,4.5,"Jl. Kendalsari No.06, Jatimulyo, Kec. Lowokwaru, Kota Malang, Jawa Timur 65141, Indonesia",ID,Malang City,East Java,Tidak Ada,+62 812-3485-5693,-7.9466381,112.6256599,Minuman,Lowokwaru,Jatimulyo,7.0,1.0,False,False,False,False,False,True,False,False,False,False,10PM,10PM,10PM,10PM,10PM,10PM,10PM,19014,8,4480.55,4.57,1122.21,7949.0,1.0,560.07,0.0,560.07
Kuliner Malang Terbaik,MAKANAN KULINER JUWIE TALI ROSO,769.0597889800704,4.530949589683471,"Gg. 1, Oro-oro Dowo, Kec. Klojen, Kota Malang, Jawa Timur 65119, Indonesia",ID,Malang City,East Java,Tidak Ada,+62 895-4139-57077,-7.9742309,112.6276785,Restoran,Klojen,Klojen,45.0,20.0,False,False,True,False,False,False,False,False,False,False,7PM,7PM,7PM,7PM,7PM,7PM,7PM,5928,22,14601.381477139506,4.53,847.21,21451.0,1.0,663.7,0.0,663.7
Restoran di Malang,Dedaunan Malang,23.0,4.1,"depan Laundry Hidayah, Gg. V No.503, Sumbersari, Kec. Lowokwaru, Kota Malang, Jawa Timur 65141, Indonesia",ID,Malang City,East Java,https://www.instagram.com/d3daunan.id/,+62 812-1952-5393,-7.9593914,112.6156133,Lainnya,Lowokwaru,Lowokwaru,33.0,79.0,False,False,True,False,False,False,False,False,False,False,11AM,3PM,2PM,11AM,11AM,5PM,5PM,19407,25,6076.58610785463,4.55,621.97,8486.0,1.0,243.06,0.0,243.06
Kuliner Malang Murah,Oleh Oleh Khas Malang - Pia Cap Mangkok Galunggung,558.0,4.8,"Jl. Galunggung No.51, Gading Kasri, Kec. Klojen, Kota Malang, Jawa Timur 65115, Indonesia",ID,Malang City,East Java,https://www.instagram.com/piatacamilan,+62 811-3101-0555,-7.9682185,112.613297,Snack,Klojen,Klojen,45.0,20.0,False,False,True,False,False,False,False,False,False,False,2PM,6PM,6PM,6PM,6PM,6PM,1PM,5928,30,7237.595369284877,4.53,847.21,21451.0,1.0,241.25,0.0,241.25
Kuliner Malang Terbaik,Ngikan.Yuk Malang,249.0,4.5,"Sebelah Bandoeng Guest House, Jl. Bandung No.20, Penanggungan, Klojen, Malang City, East Java 65113, Indonesia",ID,Malang City,East Java,http://bit.ly/Ngikan_Malang,+62 812-3342-7890,-7.9613973,112.6237784,Lainnya,Klojen,Klojen,45.0,20.0,False,False,True,False,False,False,False,False,False,False,7PM,7PM,7PM,7PM,7PM,7PM,7PM,5928,43,11154.986107854631,4.53,847.21,21451.0,1.0,259.42,0.0,259.42
Street Food Malang,Street Pan,769.0597889800704,4.530949589683471,"Parkiran Ruko, Alam Nirwana Residence, Pandanwangi, Kec. Blimbing, Kota Malang, Jawa Timur 65126, Indonesia",ID,Malang City,East Java,https://instagram.com/streetpan_,+62 822-5712-5486,-7.9515884,112.660388,Lainnya,Blimbing,Blimbing,44.0,14.0,False,False,True,False,False,False,False,False,False,False,7PM,7PM,7PM,7PM,7PM,7PM,7PM,8733,11,5562.740738569753,4.52,664.83,6759.0,1.0,505.7,0.0,505.7
Kuliner Malang Terbaik,Juminten,206.0,4.8,"Jl. Welirang No.6, Oro-oro Dowo, Kec. Klojen, Kota Malang, Jawa Timur 65112, Indonesia",ID,Malang City,East Java,Tidak Ada,+62 821-1778-8944,-7.9740578,112.6267323,Lainnya,Klojen,Klojen,45.0,20.0,False,False,True,False,False,False,False,False,False,False,7PM,7PM,7PM,7PM,7PM,7PM,7PM,5928,43,11154.986107854631,4.53,847.21,21451.0,1.0,259.42,0.0,259.42
Warung Kopi di Malang,Golden Heritage Koffie,1808.0,4.6,"Jl. Raya Tidar No.36, Karangbesuki, Kec. Sukun, Jawa Timur, 65146, Indonesia",ID,Jawa Timur,East Java,http://www.instagram.com/ghkoffie/,+62 811-3660-811,-7.9657391,112.6087291,Minuman,Sukun,Karangbesuki,6.0,4.0,False,False,False,False,False,True,False,False,False,False,5PM,7PM,4PM,5PM,7PM,7PM,5PM,19668,4,1443.25,4.62,502.83,1808.0,45.0,360.81,360.81,0.0
Street Food Malang,Warung Bu Gede,114.0,4.9,"Jl. Sigura - Gura No.9, Karangbesuki, Kec. Sukun, Kota Malang, Jawa Timur 65145, Indonesia",ID,Malang City,East Java,Tidak Ada,+62 895-4139-77421,-7.9601611,112.6049564,Warung,Sukun,Karangbesuki,6.0,4.0,False,False,True,False,False,False,False,False,False,False,7PM,7PM,7PM,7PM,7PM,7PM,7PM,19668,4,358.2,4.62,502.83,1808.0,45.0,89.55,89.55,0.0
Restoran di Malang,Warung Sate & Gule Kambing Bang Saleh,465.0,4.4,"Jl. Sarangan No.9a, Lowokwaru, Kec. Lowokwaru, Kota Malang, Jawa Timur 65141, Indonesia",ID,Malang City,East Java,Tidak Ada,+62 818-0507-5588,-7.9594848,112.6316922,Sate,Lowokwaru,Lowokwaru,33.0,79.0,False,False,False,False,False,True,False,False,False,False,6PM,7PM,7PM,6PM,7PM,7PM,7PM,19407,1,234.7,4.55,621.97,8486.0,1.0,234.7,234.7,0.0
Kuliner Malang Murah,Al-Kautsar Frozen Food,519.0,4.5,"Jl. Mawar IV No.23 - 25, Lowokwaru, Kec. Lowokwaru, Kota Malang, Jawa Timur 65141, Indonesia",ID,Malang City,East Java,https://www.instagram.com/tokofrozen,+62 341 475463,-7.9575778,112.6330909,Frozen Food,Lowokwaru,Lowokwaru,33.0,79.0,False,False,True,False,False,False,False,False,False,False,12PM,10AM,10AM,10AM,10AM,2PM,7PM,19407,3,358.85,4.55,621.97,8486.0,1.0,119.62,119.62,0.0
Warung Makan di Malang,Warung Mak Ning,16.0,4.5,"Jl. Sigura - Gura No.2, Sumbersari, Kec. Lowokwaru, Kota Malang, Jawa Timur 65145, Indonesia",ID,Malang City,East Java,Tidak Ada,+62 813-5912-3560,-7.9570929,112.6127306,Warung,Lowokwaru,Lowokwaru,33.0,79.0,False,False,True,False,False,False,False,False,False,False,5AM,5AM,8PM,9AM,3PM,12PM,11AM,19407,28,7638.795369284877,4.55,621.97,8486.0,1.0,272.81,0.0,272.81
Kuliner Malang Terbaik,Warung Champions,64.0,4.6,"Jl. Brigjend Slamet Riadi No.89B, Oro-oro Dowo, Kec. Klojen, Kota Malang, Jawa Timur 65113, Indonesia",ID,Malang City,East Java,Tidak Ada,+62 813-3530-9046,-7.9687108,112.6288449,Warung,Klojen,Klojen,45.0,20.0,False,False,True,False,False,False,False,False,False,False,7PM,7PM,7PM,7PM,7PM,7PM,7PM,5928,53,12486.890738569753,4.53,847.21,21451.0,1.0,235.6,0.0,235.6
Warung Kopi di Malang,Hindia Koffie En Eaten,752.0,4.5,"Jl. Simpang Ijen No.7, Oro-oro Dowo, Kec. Klojen, Kota Malang, Jawa Timur 65119, Indonesia",ID,Malang City,East Java,https://lynk.id/hindiakoffie,+62 812-1700-6677,-7.9639094,112.6220598,Minuman,Klojen,Klojen,45.0,20.0,False,False,False,False,False,True,False,False,False,False,7PM,8PM,8PM,7PM,6PM,7PM,7PM,5928,48,15239.695369284877,4.53,847.21,21451.0,1.0,317.49,0.0,317.49
Warung Makan di Malang,Warung Makan “ BUTAJIE”,1.0,5.0,"Jl. Panglima Sudirman No.H 8, Klojen, Kec. Klojen, Kota Malang, Jawa Timur 65111, Indonesia",ID,Malang City,East Java,Tidak Ada,Tidak Ada,-7.9750413,112.6384097,Warung,Klojen,Klojen,45.0,20.0,False,False,True,False,False,False,False,False,False,False,10AM,1PM,10AM,11AM,10AM,7AM,9AM,5928,53,12486.890738569753,4.53,847.21,21451.0,1.0,235.6,0.0,235.6
Warung Makan di Malang,Pizza Hut Ristorante,6067.0,4.6,"Jl. Semeru No.37, Kauman, Kec. Klojen, Kota Malang, Jawa Timur 65111, Indonesia",ID,Malang City,East Java,https://www.pizzahut.co.id/,+62 1 500 600,-7.9762821,112.6270576,Fast Food,Klojen,Kauman,10.0,6.0,False,False,True,False,False,False,False,False,False,False,6PM,6PM,6PM,7PM,6PM,7PM,6PM,9063,2,3086.9,4.43,1342.15,7391.0,2.0,1543.45,1543.45,0.0
Warung Kopi di Malang,MAHBOEN Coffee,403.0,4.6,"Jl. Simpang Panji Suroso No.136, Arjosari, Kec. Blimbing, Kota Malang, Jawa Timur 65126, Indonesia",ID,Malang City,East Java,https://www.instagram.com/mahboen/?hl=en,Tidak Ada,-7.9328424,112.6518306,Minuman,Blimbing,Arjosari,1.0,1.0,False,False,False,False,False,True,False,False,False,False,6PM,4PM,5PM,7PM,4PM,6PM,12PM,10200,1,203.8,4.52,199.8,403.0,5.0,203.8,203.8,0.0
Warung Makan di Malang,"Warung Bu Min - Rujak Cingur, Tahu Telur, Nasi Campur",32.0,5.0,"Jl. Bunga Kumis Kucing Dalam No.46-41, Jatimulyo, Kec. Lowokwaru, Kota Malang, Jawa Timur 65141, Indonesia",ID,Malang City,East Java,Tidak Ada,Tidak Ada,-7.9512539,112.6197512,Olahan Nasi,Lowokwaru,Jatimulyo,7.0,1.0,False,False,True,False,False,False,False,False,False,False,7PM,11AM,11AM,4PM,8PM,4PM,2PM,19014,1,18.5,4.57,1122.21,7949.0,1.0,18.5,18.5,0.0
Kuliner Malang Murah,Kopi Perempat,90.0,4.5,"Jl. Semeru No.16, RW.3, Oro-oro Dowo, Kec. Klojen, Kota Malang, Jawa Timur 65119, Indonesia",ID,Malang City,East Java,https://www.tiktok.com/@kopiperempatmalang,+62 813-3285-4333,-7.9763162,112.6285576,Minuman,Klojen,Klojen,45.0,20.0,False,False,True,False,False,False,False,False,False,False,9PM,8PM,8PM,9PM,4PM,8PM,8PM,5928,48,15239.695369284877,4.53,847.21,21451.0,1.0,317.49,0.0,317.49
Warung Kopi di Malang,8ozcs,1589.0,4.5,"Jl. Citandui No.74, Purwantoro, Kec. Blimbing, Kota Malang, Jawa Timur 65122, Indonesia",ID,Malang City,East Java,https://www.instagram.com/8ozcs?igsh=ZHQ3azF1em4xbWp6,+62 341 4374015,-7.9570712,112.6433178,Lainnya,Blimbing,Blimbing,44.0,14.0,False,False,False,False,False,False,True,False,False,False,7PM,11AM,12PM,9AM,2PM,5PM,6PM,8733,11,5562.740738569753,4.52,664.83,6759.0,1.0,505.7,0.0,505.7
Warung Kopi di Malang,Ada Apa Dengan Kopi (AADK) Malang - Coffee & Eatery,1888.0,4.6,"Jl. Bandung No.28, Penanggungan, Kec. Klojen, Kota Malang, Jawa Timur 65113, Indonesia",ID,Malang City,East Java,Tidak Ada,+62 898-9739-939,-7.9607566,112.62299,Minuman,Klojen,Klojen,45.0,20.0,False,False,False,False,False,True,False,False,False,False,2PM,3PM,3PM,4PM,8PM,8PM,4PM,5928,48,15239.695369284877,4.53,847.21,21451.0,1.0,317.49,0.0,317.49
Kuliner Malang Murah,Tahwa Mas Agus,1019.0,4.7,"Jl. Aries Munandar No.20, Kiduldalem, Kec. Klojen, Kota Malang, Jawa Timur 65119, Indonesia",ID,Malang City,East Java,https://www.instagram.com/tahwamasagus?igsh=MWdtYnlnN29qbDI0cg==,+62 821-1777-5542,-7.9816906,112.6337404,Lainnya,Klojen,Kiduldalem,4.0,8.0,False,False,True,False,False,False,False,False,False,False,5PM,5PM,5PM,12PM,2PM,4PM,6PM,6240,4,3419.2,4.4,1087.93,7541.0,2.0,854.8,854.8,0.0
Kuliner Malang Murah,Tempat makan,769.0597889800704,4.530949589683471,"Jl. Danau Kerinci Raya, Sawojajar, Kec. Kedungkandang, Kota Malang, Jawa Timur 37172, Indonesia",ID,Malang City,East Java,Tidak Ada,+62 813-3372-5217,-7.9752658,112.6616573,Lainnya,Kedungkandang,Kedungkandang,10.0,10.0,False,False,True,False,False,False,False,False,False,False,7PM,7PM,7PM,7PM,7PM,7PM,7PM,11781,4,548.445369284877,4.58,367.15,2077.0,1.0,137.11,137.11,0.0
Warung Makan di Malang,Waroeng D’Tegaland,21.0,4.5,"Jl. Kemantren 1 No.45, Bandungrejosari, Kec. Sukun, Kota Malang, Jawa Timur 65148, Indonesia",ID,Malang City,East Java,Tidak Ada,+62 812-3340-3619,-7.9982484,112.610625,Warung,Sukun,Bandungrejosari,0.0,2.0,False,False,True,False,False,False,False,False,False,False,7PM,7PM,7PM,7PM,7PM,7PM,7PM,31098,3,44.35,4.68,181.13,769.0597889800704,1.0,14.78,14.78,0.0
Warung Kopi di Malang,Malbourne Coffee Co,489.0,4.7,"Jl. Bantaran No.2D, Purwantoro, Kec. Blimbing, Kota Malang, Jawa Timur 65142, Indonesia",ID,Malang City,East Java,Tidak Ada,+62 812-3078-0638,-7.9498201,112.6388059,Minuman,Blimbing,Blimbing,44.0,14.0,False,False,False,False,False,True,False,False,False,False,4PM,4PM,2PM,3PM,5PM,2PM,11AM,8733,15,1690.9,4.52,664.83,6759.0,1.0,112.73,0.0,112.73
Warung Makan di Malang,Pujasera Stasiun Malang,87.0,4.0,"Jl. Trunojoyo No.68, Klojen, Kec. Klojen, Kota Malang, Jawa Timur 65111, Indonesia",ID,Malang City,East Java,Tidak Ada,+62 341 351899,-7.9756477,112.6369028,Warung,Klojen,Klojen,45.0,20.0,False,False,True,False,False,False,False,False,False,False,7PM,7PM,7PM,7PM,7PM,7PM,7PM,5928,53,12486.890738569753,4.53,847.21,21451.0,1.0,235.6,0.0,235.6
Warung Kopi di Malang,Baratimur Kopi,687.0,4.6,"Songgoriti St No.16, Lowokwaru, Malang City, East Java 65141, Indonesia",ID,Malang City,East Java,https://www.instagram.com/baratimur.co/,+62 821-3752-3266,-7.960235,112.6347713,Minuman,Lowokwaru,Lowokwaru,33.0,79.0,False,False,False,False,False,True,False,False,False,False,8PM,8PM,7PM,8PM,8PM,9PM,8PM,19407,29,11246.75,4.55,621.97,8486.0,1.0,387.82,0.0,387.82
Restoran di Malang,BUBUR MANADO CORNER,42.0,4.8,"Jl. Jaksa Agung Suprapto Gg. 1 No.25, Samaan, Kec. Klojen, Kota Malang, Jawa Timur 65112, Indonesia",ID,Malang City,East Java,Tidak Ada,Tidak Ada,-7.9665351,112.6311962,Lainnya,Klojen,Klojen,45.0,20.0,False,False,True,False,False,False,False,False,False,False,2PM,4PM,7PM,6PM,1PM,12PM,1PM,5928,43,11154.986107854631,4.53,847.21,21451.0,1.0,259.42,0.0,259.42
Kuliner Malang Murah,takitaki frozen food,269.0,5.0,"Jl. Parangtritis No.11A, Samaan, Kec. Klojen, Kota Malang, Jawa Timur 65141, Indonesia",ID,Malang City,East Java,Tidak Ada,+62 821-2200-0982,-7.960598,112.630763,Frozen Food,Klojen,Klojen,45.0,20.0,False,False,True,False,False,False,False,False,False,False,7AM,8AM,8AM,8AM,8AM,7AM,7AM,5928,3,423.75,4.53,847.21,21451.0,1.0,141.25,141.25,0.0
Kuliner Malang Murah,Serabi Notosuman,181.0,4.4,"Jl. Mahakam No.17, Rampal Celaket, Kec. Klojen, Kota Malang, Jawa Timur 65111, Indonesia",ID,Malang City,East Java,Tidak Ada,+62 851-0319-9170,-7.963789,112.636715,Lainnya,Klojen,Klojen,45.0,20.0,False,False,True,False,False,False,False,False,False,False,11AM,11AM,10AM,12PM,11AM,12PM,12PM,5928,43,11154.986107854631,4.53,847.21,21451.0,1.0,259.42,0.0,259.42
Warung Makan di Malang,Warung makan 45,2.0,5.0,"Jl. Lowokdoro No.56, Gadang, Kec. Sukun, Kota Malang, Jawa Timur 65149, Indonesia",ID,Malang City,East Java,Tidak Ada,+62 858-5273-6409,-8.02353,112.6274992,Warung,Sukun,Gadang,3.0,1.0,False,False,True,False,False,False,False,False,False,False,10AM,10PM,10AM,12PM,9AM,10AM,9PM,20229,3,12.3,4.37,6.0,10.0,2.0,4.1,4.1,0.0
Restoran di Malang,Rawon Brintik Miniasih,390.0,4.3,"Jl. Diponegoro IIA No.1, Klojen, Kec. Klojen, Kota Malang, Jawa Timur 65111, Indonesia",ID,Malang City,East Java,Tidak Ada,+62 341 327206,-7.9705476,112.6333697,Rawon,Klojen,Klojen,45.0,20.0,False,False,False,False,False,True,False,False,False,False,7AM,2PM,2PM,11AM,11AM,1PM,9AM,5928,4,639.85,4.53,847.21,21451.0,1.0,159.96,159.96,0.0
Warung Makan di Malang,Warung Makan Selera Anda,2.0,5.0,"Pujasera Sriwijaya No. 12, Jl. Trunojoyo, Klojen, Kec. Klojen, Kota Malang, Jawa Timur 65111, Indonesia",ID,Malang City,East Java,Tidak Ada,+62 858-9534-7626,-7.9783043,112.6365318,Warung,Klojen,Klojen,45.0,20.0,False,False,True,False,False,False,False,False,False,False,6PM,2PM,7PM,11AM,3PM,9AM,7PM,5928,53,12486.890738569753,4.53,847.21,21451.0,1.0,235.6,0.0,235.6
Restoran di Malang,Soto Betawi Bang Pit,50.0,4.8,"Jl. Buring No.3, Oro-oro Dowo, Kec. Klojen, Kota Malang, Jawa Timur 65199, Indonesia",ID,Malang City,East Java,Tidak Ada,+62 895-3846-59256,-7.9726997,112.6275238,Soto,Kedungkandang,Buring,1.0,0.0,False,False,False,False,False,True,False,False,False,False,7PM,7PM,7PM,7PM,7PM,7PM,7PM,15876,1,27.4,4.53,498.73,1631.0,7.0,27.4,27.4,0.0
Warung Kopi di Malang,Warkop Brewok,1692.0,4.6,"Jl. Kedawung No.93, Tulusrejo, Kec. Lowokwaru, Kota Malang, Jawa Timur 65141, Indonesia",ID,Malang City,East Java,http://www.instagram.com/warkopbrewok.mlg,+62 852-9111-5758,-7.9518837,112.6341969,Minuman,Lowokwaru,Lowokwaru,33.0,79.0,False,False,True,False,False,False,False,False,False,False,5PM,11AM,12PM,11AM,9PM,9PM,11AM,19407,29,11246.75,4.55,621.97,8486.0,1.0,387.82,0.0,387.82
Warung Makan di Malang,Rumah Makan Minang Klasik,33.0,4.1,"Jl. Laksda Adi Sucipto No.236, Pandanwangi, Kec. Blimbing, Kota Malang, Jawa Timur 65121, Indonesia",ID,Malang City,East Java,Tidak Ada,+62 812-1617-9725,-7.9466693,112.6530955,Warung,Blimbing,Blimbing,44.0,14.0,False,False,True,False,False,False,False,False,False,False,3PM,8AM,5PM,2PM,4PM,3PM,8AM,8733,16,3546.3,4.52,664.83,6759.0,1.0,221.64,0.0,221.64
Warung Kopi di Malang,Quiet Cafe,297.0,4.6,"Jl. Brawijaya, Pasar Bunga, Kec. Klojen, Kota Malang, Jawa Timur 65111, Indonesia",ID,Malang City,East Java,Tidak Ada,+62 813-3216-0016,-7.9769308,112.6308016,Minuman,Klojen,Klojen,45.0,20.0,False,False,True,False,False,False,False,False,False,False,2PM,12PM,1PM,2PM,3PM,12PM,12PM,5928,48,15239.695369284877,4.53,847.21,21451.0,1.0,317.49,0.0,317.49
Warung Kopi di Malang,JOKOPI - Malang,1234.0,4.6,"Jl. Jakarta No.26, Penanggungan, Kec. Klojen, Kota Malang, Jawa Timur 65113, Indonesia",ID,Malang City,East Java,https://www.instagram.com/jo.ko.pi/,+62 813-3308-4175,-7.9629648,112.6226969,Lainnya,Klojen,Klojen,45.0,20.0,False,False,False,False,False,True,False,False,False,False,10PM,10PM,10PM,10PM,10PM,10PM,10PM,5928,43,11154.986107854631,4.53,847.21,21451.0,1.0,259.42,0.0,259.42
Restoran di Malang,Soto Madura Oro-Oro Dowo Malang,157.0,4.3,"Jl. Brigjend Slamet Riadi, Oro-oro Dowo, Kec. Klojen, Kota Malang, Jawa Timur 65119, Indonesia",ID,Malang City,East Java,Tidak Ada,+62 813-1535-8798,-7.9695447,112.6287626,Soto,Klojen,Klojen,45.0,20.0,False,False,True,False,False,False,False,False,False,False,5PM,5PM,7PM,6PM,5PM,10AM,7PM,5928,6,3557.15,4.53,847.21,21451.0,1.0,592.86,0.0,592.86
Kuliner Malang Murah,Kuliner,769.0597889800704,4.530949589683471,"Jl. S. Supriadi, Bandungrejosari, Kec. Sukun, Kota Malang, Jawa Timur 65146, Indonesia",ID,Malang City,East Java,Tidak Ada,+62 822-1449-2717,-8.0071533,112.6186283,Restoran,Sukun,Bandungrejosari,0.0,2.0,False,False,True,False,False,False,False,False,False,False,7PM,7PM,7PM,7PM,7PM,7PM,7PM,31098,2,389.7953692848769,4.68,181.13,769.0597889800704,1.0,194.9,194.9,0.0
Restoran di Malang,Makan Enak - กินดี (Makanan Thailand Indonesia),1.0,5.0,"Jl. Menur No.7, Lowokwaru, Kec. Lowokwaru, Kota Malang, Jawa Timur 65141, Indonesia",ID,Malang City,East Java,Tidak Ada,Tidak Ada,-7.9547859,112.6310459,Lainnya,Lowokwaru,Lowokwaru,33.0,79.0,False,False,True,False,False,False,False,False,False,False,7PM,7PM,7PM,7PM,7PM,7PM,7PM,19407,25,6076.58610785463,4.55,621.97,8486.0,1.0,243.06,0.0,243.06
Warung Kopi di Malang,Toko Kopi Makmur (Malang),486.0,4.7,"Jl. Cengkeh No.60 kav4, Jatimulyo, Kec. Lowokwaru, Kota Malang, Jawa Timur 65141, Indonesia",ID,Malang City,East Java,Tidak Ada,+62 877-5996-6009,-7.9456569,112.6208499,Minuman,Lowokwaru,Jatimulyo,7.0,1.0,False,False,True,False,False,False,False,False,False,False,5PM,8PM,5PM,8PM,9PM,12PM,8PM,19014,8,4480.55,4.57,1122.21,7949.0,1.0,560.07,0.0,560.07
Warung Kopi di Malang,Kopituju,1697.0,4.4,"Jl. Sutan Syahrir No.7, Sukoharjo, Kec. Klojen, Kota Malang, Jawa Timur 65117, Indonesia",ID,Malang City,East Java,https://www.instagram.com/kopituju/,+62 811-3032-577,-7.9856084,112.6309766,Lainnya,Klojen,Klojen,45.0,20.0,False,False,False,False,False,True,False,False,False,False,11AM,11AM,12PM,12PM,1PM,1PM,12PM,5928,43,11154.986107854631,4.53,847.21,21451.0,1.0,259.42,0.0,259.42
Kuliner Malang Murah,Warung makan malam,769.0597889800704,4.530949589683471,"Kawi St No.22 A, Bareng, Klojen, Malang City, East Java 65119, Indonesia",ID,Malang City,East Java,Tidak Ada,+62 857-3399-7387,-7.9752965,112.6191213,Warung,Klojen,Bareng,3.0,2.0,False,False,True,False,False,False,False,False,False,False,7PM,7PM,7PM,7PM,7PM,7PM,7PM,15048,5,3554.740738569754,4.49,1186.25,5376.0,10.0,710.95,710.95,0.0
Warung Makan di Malang,Warung Nasi Goreng Cak Man,10.0,5.0,"2JHV+V5M, Bunulrejo, Blimbing, Malang City, East Java 65123, Indonesia",ID,Malang City,East Java,Tidak Ada,+62 817-5402-144,-7.9702951,112.6429132,Olahan Nasi,Blimbing,Blimbing,44.0,14.0,False,False,True,False,False,False,False,False,False,False,7PM,7PM,7PM,7PM,7PM,7PM,7PM,8733,5,792.25,4.52,664.83,6759.0,1.0,158.45,158.45,0.0
Restoran di Malang,Ayam Lodho Kaliurang Resto,214.0,4.5,"Jl. Kaliurang No.36, Lowokwaru, Kec. Lowokwaru, Kota Malang, Jawa Timur 65111, Indonesia",ID,Malang City,East Java,Tidak Ada,+62 341 350043,-7.9630775,112.6327171,Ayam,Lowokwaru,Lowokwaru,33.0,79.0,False,False,False,False,False,True,False,False,False,False,8AM,1PM,1PM,4PM,1PM,7AM,11AM,19407,5,543.945369284877,4.55,621.97,8486.0,1.0,108.79,108.79,0.0
Warung Makan di Malang,Soto & Rawon Finayan,62.0,4.5,"Jl. Kendalsari Barat I No.3, Tulusrejo, Kec. Lowokwaru, Kota Malang, Jawa Timur 65141, Indonesia",ID,Malang City,East Java,Tidak Ada,+62 895-4223-97980,-7.9445466,112.6232614,Soto,Lowokwaru,Lowokwaru,33.0,79.0,False,False,True,False,False,False,False,False,False,False,7PM,7PM,7PM,7PM,7PM,7PM,7PM,19407,4,933.2,4.55,621.97,8486.0,1.0,233.3,233.3,0.0
Warung Kopi di Malang,Kopi Letek,558.0,4.4,"Jalan Sudimoro, Mojolangu, Kec. Lowokwaru, Kota Malang, Jawa Timur 65142, Indonesia",ID,Malang City,East Java,https://www.instagram.com/kopiletek/,+62 813-3049-5973,-7.9334117,112.6296029,Minuman,Lowokwaru,Lowokwaru,33.0,79.0,False,False,False,False,False,True,False,False,False,False,6PM,7PM,7PM,3PM,7PM,4PM,7PM,19407,29,11246.75,4.55,621.97,8486.0,1.0,387.82,0.0,387.82
Restoran di Malang,Sate Padang Bang Roni,137.0,4.7,"Jl. Ade Irma Suryani No.5B, Kauman, Kec. Klojen, Kota Malang, Jawa Timur, Indonesia",ID,Malang City,East Java,Tidak Ada,+62 813-3454-1456,-7.9852136,112.6305994,Sate,Klojen,Kauman,10.0,6.0,False,False,True,False,False,False,False,False,False,False,7PM,7PM,7PM,7PM,7PM,7PM,7PM,9063,1,70.85,4.43,1342.15,7391.0,2.0,70.85,70.85,0.0
Warung Kopi di Malang,Vosco Coffee,1954.0,4.5,"Jl. Borobudur No.27A, Mojolangu, Kec. Lowokwaru, Kota Malang, Jawa Timur 65142, Indonesia",ID,Malang City,East Java,https://www.instagram.com/voscocoffee/,+62 821-4297-4169,-7.940185,112.637716,Minuman,Lowokwaru,Lowokwaru,33.0,79.0,False,False,False,False,False,False,False,False,True,False,3PM,11AM,12PM,2PM,2PM,1PM,7PM,19407,29,11246.75,4.55,621.97,8486.0,1.0,387.82,0.0,387.82
Warung Makan di Malang,Warung Makan Ibu Rani,1.0,5.0,"Jl. Brigjend Slamet Riadi No.87, Oro-oro Dowo, Kec. Klojen, Kota Malang, Jawa Timur 65119, Indonesia",ID,Malang City,East Java,Tidak Ada,+62 857-4081-5188,-7.9690616,112.6289267,Warung,Klojen,Klojen,45.0,20.0,False,False,True,False,False,False,False,False,False,False,7PM,7PM,7PM,7PM,7PM,7PM,7PM,5928,53,12486.890738569753,4.53,847.21,21451.0,1.0,235.6,0.0,235.6
Warung Kopi di Malang,Blue Coffee Shops,16.0,4.9,"2JQJ+R5F, Jl. Sendang Biru, Samaan, Kec. Klojen, Kota Malang, Jawa Timur 65141, Indonesia",ID,Malang City,East Java,Tidak Ada,Tidak Ada,-7.9604317,112.6304274,Minuman,Klojen,Klojen,45.0,20.0,False,False,True,False,False,False,False,False,False,False,7PM,7PM,7PM,7PM,7PM,7PM,7PM,5928,48,15239.695369284877,4.53,847.21,21451.0,1.0,317.49,0.0,317.49
Restoran di Malang,"Tahu Tek Pak Latief (Khas Malang), Cabang Patimura",38.0,4.4,"Jl. Patimura No.2a, Klojen, Kec. Klojen, Kota Malang, Jawa Timur 65111, Indonesia",ID,Malang City,East Java,Tidak Ada,Tidak Ada,-7.9717775,112.6330151,Snack,Klojen,Klojen,45.0,20.0,False,False,True,False,False,False,False,False,False,False,7PM,7PM,7PM,7PM,7PM,7PM,7PM,5928,30,7237.595369284877,4.53,847.21,21451.0,1.0,241.25,0.0,241.25
Kuliner Malang Murah,Jajanan hits,769.0597889800704,4.530949589683471,"Jl. Sigura - Gura No.25, Sumbersari, Kec. Lowokwaru, Kota Malang, Jawa Timur 65145, Indonesia",ID,Malang City,East Java,Tidak Ada,Tidak Ada,-7.9576662,112.608987,Lainnya,Lowokwaru,Lowokwaru,33.0,79.0,False,False,True,False,False,False,False,False,False,False,3PM,1PM,5PM,3AM,10AM,9AM,2PM,19407,25,6076.58610785463,4.55,621.97,8486.0,1.0,243.06,0.0,243.06
Kuliner Malang Murah,Mie Aceh Darussalam - Stasiun Malang,91.0,5.0,"Jl. Trunojoyo No.10g, Klojen, Kec. Klojen, Kota Malang, Jawa Timur 65111, Indonesia",ID,Malang City,East Java,Tidak Ada,+62 852-0697-9639,-7.9766932,112.6368784,Mie,Klojen,Klojen,45.0,20.0,False,False,True,False,False,False,False,False,False,False,7PM,7PM,7PM,7PM,7PM,7PM,7PM,5928,18,10453.095369284876,4.53,847.21,21451.0,1.0,580.73,0.0,580.73
Warung Makan di Malang,Warung Pojok Mbak Ning,9.0,4.7,"Jalan Jaksa Agung Suprapto kampung putih no. 3 klojen, Samaan, Kec. Klojen, Kota Malang, Jawa Timur 65111, Indonesia",ID,Malang City,East Java,Tidak Ada,+62 817-0502-848,-7.9728903,112.6308866,Warung,Klojen,Klojen,45.0,20.0,False,False,True,False,False,False,False,False,False,False,7PM,7PM,7PM,7PM,7PM,7PM,7PM,5928,53,12486.890738569753,4.53,847.21,21451.0,1.0,235.6,0.0,235.6
